Product Name,Prices,Min Orders
Hot Drill Rhinestone Oversized Tshirt Custom Your Design Logo Shine Glitter Rhinestone Luxury Men'sT-shirts100% Cotton,$1.80-2.65,10 pieces
ODM 220 GSM 100 Cotton Plain Short Sleeve Oversized Mens Thick Tshirt Heavyweight Essentials Blank Custom LogoT-shirtSport,$2.98-8.56,50 pieces
Custom Logo Puff Printed Tee Shirt Blank Plain OversizedT-shirtGraphic Cotton Custom T Shirt Men Tshirt for Men,$4.00-5.00,20 pieces
Hot Sale Summer Light Weight Bamboo Fiber Crew Neck Short Sleeve Oversized Boxing t Shirt for Men,$2.41-6.93,50 pieces
High Quality 100% Cotton Custom Tshirt Men With Logo Custom Crystal Logo Rhinestone TransferT-shirtFor Men Fitted,$6.98-9.56,10 pieces
HIC Wholesale Unisex High Quality 180g 100%Cotton Custom Logo Printing Blank O-Neck Plus Size Men'sT-shirts,$2.22-2.89,3 pieces
Dry Fit T Shirt 100% Polyester T Shirt Sublimation Blanks Tshirt With Logo Custom Logo Printed T Shirt Men PlainT-shirtfor Men,$0.55-0.85,50 pieces
Wholesale Custom Your Brand Logo 100% Cotton Blank Men T Shirt Plain Casual Men'sT-shirts,$1.89-3.78,5 pieces
Custom Club Name Dry-fit Sublimated Polo Shirt Men Golf Polo t Shirt Loose Fit Regular Fitted Sports Uniform Staff t Shirt,$1.02-4.63,50 pieces
Clothing Manufacturers Custom Men Clothes Oversized Streetwear 100% Cotton 300 Gsm Tshirt Blank Graphic Print T Shirt,$3.99-9.80,10 pieces
F230699 Women's Skirts Designer Clothes Women Long Sleeve Crop Top T Shirt and Casual Ladies Dresses Long Maxi Y2k Skirt,$12.00-16.00,20 sets
Custom Logo Vintage Acid Washed T Shirt Men Distressed Heavyweight Cotton Blank Oversized Tshirt 100% for Men'sT-shirt,$4.30-5.38,2 pieces
High Quality Custom Logo 260Gsm Men'S T Shirt Streetwear Oversized Drop Shoulder T Shirts Heavy Weight CottonT-Shirts,$2.57-4.00,10 pieces
"New Trending BoxyT-Shirts| Boxy Drop Shoulder T-Shirt Tee |Custom Logo, Color, Size /T-Shirtsfor Men Crop Tops Full Printing",$2.50-9.49,2 pieces
Streetwear Custom Screen Printing Washed Worn Out Long Sleeve Double Layer T Shirt Men Alike Two Piece Tshirt Hip HopT-shirt,$12.50-15.50,10 pieces
Wholesale High Quality Blank 100% Cotton 210grams Custom logo Printing Heavyweight Oversized Tshirts Plus Size Men'sT-shirts,$0.80-3.20,2 pieces
Custom t Shirt PrintingT-shirtWith logo for Men Your Own Brand Heat Transfer Customize Tee Shirts With Tag Custom t Shirts,$0.70-1.37,15 pieces
OEM/ODM Heavyweight High Quality 100% Cotton Drop Shoulder Oversize Mens t Shirts,$6.59-7.89,5 pieces
OEM Clothing Manufacturers Custom LOGO Wholesale 100% Cotton 3D Puff Tshirts Foaming Shirt Froth Shirts Custom t Shirt,$2.29-4.19,2 pieces
280GSM Custom Heavy Tees Thick Cotton Tshirts High Collar Big and Tall Fit Mock Neck Black Drop Shoulder T Shirt,$2.90-4.20,2 pieces
Sublimation Oversized Dtg Print Tshirt 100% Cotton Sports Shirt Man Custom Men Crop Sport High Quality CottonT-Shirt,$4.63-6.93,50 pieces
DTG Men'S Tshirt 100% Cotton Digital Printing t Tshirt Screen Printing Heavy Weight Oversized StreetwearT-Shirtsfor Men,$5.00-5.80,2 pieces
2024 New Bapes Shark 100% Cotton Camo Pattern T-shirt High Quality Unisex Shirt Customized Logo Summer Shirt WholesaleT-shirts,$11.00-12.50,3 pieces
Men Soft Washed Contrast Stitching Vintage Oversize t Shirt,$2.50-3.50,2 units
Boutique Wholesale 2024 Summer New Fashionable Sweet Round Neck Short Sleeved Loose and Versatile Women'sT-shirt,$10.80-11.90,1 piece
Custom Logo High Quality 100% Polyester Tshirt Blank t Shirts Printing Gym Sport Quick Dry Plain Sublimation White T Shirt,$0.75-1.32,50 pieces
Custom Tee Shirts 230 Gsm Cotton Logo Blank Oversized t Shirt Manufacturer Wholesale Men's Custom T-ShirtT-shirtsfor Men,$2.29-3.98,2 pieces
Wholesale of European and American New High-quality Top Panels Men's Polo Shirt Plus Size Men'sT-shirts,$2.90-3.40,15 pieces
Wholesale Low Price Men's Quick Dry Tshirts Custom Sublimation Printing With Logo Unisex SportsT-shirtsfor Men,$0.90-1.20,2 pieces
Custom Mens Cotton 230gsm Luxury Quality Heavy Weight Drop Round Neck Oversized Custom Design Streetwear Boxy t Shirt,$3.28-6.59,2 pieces
Custom Cotton HeavyT-shirtThermal Long Sleeved Shirt for Men Full Graphic Screen Dtg Print White Long Sleeve Waffle T Shirt,$4.35-7.35,50 pieces
DOVEN OEM Wholesale Blank Vintage Distressed T Shirts Streetwear Heavy Weight Print LogoT-Shirt,$8.90-11.90,50 pieces
Factory Price Polyester Plain Blank Men Polo Shirts Custom logo Printed Embroidery Men's Polo t Shirt,$0.81-1.66,20 pieces
"Short SleevedT-shirtfor Men in Summer, Thin, Breathable Round , Waffle Top, Half Sleeved",$1.55-1.85,3 pieces
YSJY Custom Hip Hop Streetwear Screen Print Graphic RhinestonesT-shirtPour Hommes Cotton Heavy Oversized T Shirt for Men,$9.60-36.90,10 pieces
Y2k Custom Casual Fashion Knitted Boxy t Shirt Hip Hop Tshirt 3D Print Washed Oversized Boxy Fit t Shirt 300 Gsm,$7.58-8.88,2 pieces
Hot Sell Puff Printing Blank Tee Shirt Men Plain Heavyweight Cotton Custom Logo Oversize Plain Graphic Sublimation MensT-Shirts,$2.67-4.21,2 pieces
Manufacturer Custom Puff Print Women'sT-ShirtsSummer Vintage Casual Lounge Wear Set Women T-shirt and Shorts Two Piece Set,$7.25-8.50,100 sets
2024 Summer New Men's Casual Polo Shirt Fashion Lapel Button Business Color Matching Tops Outwear Short SleeveT-shirt,$5.56-6.22,2 pieces
High Quality Custom logo Tshirt Comfortable 3D Puff Mutil ColorT-shirt250GSM Crew Neck t Shirt for Men,$3.39-4.69,2 pieces
